{
  "catalogVersion": "1.0.0-candidate.1",
  "domain": "VEGETAL",
  "status": "CANDIDATE",
  "denominatorDefinition": "Cada entrada nominal explícita de la tabla «Línea base agrícola v1» se representa una vez; las frases abiertas se conservan como CONTROLLED_PLACEHOLDER para revisión editorial.",
  "entries": [
    {
      "code": "AR-VEG-MAIZ",
      "familyCode": "CEREALES-PSEUDOCEREALES",
      "canonicalName": "maíz",
      "scientificName": null,
      "entryType": "SPECIES",
      "supportLevel": "CATALOGADA",
      "reviewStatus": "APPROVED",
      "lifecycleStatus": "ACTIVE",
      "jurisdictions": [
        "AR"
      ],
      "sourceIds": [
        "SRC-INDEC-CNA-2018",
        "SRC-SAGYP-ESTIMACIONES"
      ],
      "aliases": [],
      "regulated": false,
      "requiresValidatedProfile": false
    },
    {
      "code": "AR-VEG-TRIGO-PAN",
      "familyCode": "CEREALES-PSEUDOCEREALES",
      "canonicalName": "trigo pan",
      "scientificName": null,
      "entryType": "SPECIES",
      "supportLevel": "CATALOGADA",
      "reviewStatus": "APPROVED",
      "lifecycleStatus": "ACTIVE",
      "jurisdictions": [
        "AR"
      ],
      "sourceIds": [
        "SRC-INDEC-CNA-2018",
        "SRC-SAGYP-ESTIMACIONES"
      ],
      "aliases": [],
      "regulated": false,
      "requiresValidatedProfile": false
    },
    {
      "code": "AR-VEG-TRIGO-CANDEAL",
      "familyCode": "CEREALES-PSEUDOCEREALES",
      "canonicalName": "trigo candeal",
      "scientificName": null,
      "entryType": "SPECIES",
      "supportLevel": "CATALOGADA",
      "reviewStatus": "APPROVED",
      "lifecycleStatus": "ACTIVE",
      "jurisdictions": [
        "AR"
      ],
      "sourceIds": [
        "SRC-INDEC-CNA-2018",
        "SRC-SAGYP-ESTIMACIONES"
      ],
      "aliases": [],
      "regulated": false,
      "requiresValidatedProfile": false
    },
    {
      "code": "AR-VEG-ARROZ",
      "familyCode": "CEREALES-PSEUDOCEREALES",
      "canonicalName": "arroz",
      "scientificName": null,
      "entryType": "SPECIES",
      "supportLevel": "CATALOGADA",
      "reviewStatus": "APPROVED",
      "lifecycleStatus": "ACTIVE",
      "jurisdictions": [
        "AR"
      ],
      "sourceIds": [
        "SRC-INDEC-CNA-2018",
        "SRC-SAGYP-ESTIMACIONES"
      ],
      "aliases": [],
      "regulated": false,
      "requiresValidatedProfile": false
    },
    {
      "code": "AR-VEG-CEBADA-CERVECERA-FORRAJERA",
      "familyCode": "CEREALES-PSEUDOCEREALES",
      "canonicalName": "cebada cervecera/forrajera",
      "scientificName": null,
      "entryType": "PRODUCTION_GROUP",
      "supportLevel": "CATALOGADA",
      "reviewStatus": "APPROVED",
      "lifecycleStatus": "ACTIVE",
      "jurisdictions": [
        "AR"
      ],
      "sourceIds": [
        "SRC-INDEC-CNA-2018",
        "SRC-SAGYP-ESTIMACIONES"
      ],
      "aliases": [],
      "regulated": false,
      "requiresValidatedProfile": false
    },
    {
      "code": "AR-VEG-AVENA",
      "familyCode": "CEREALES-PSEUDOCEREALES",
      "canonicalName": "avena",
      "scientificName": null,
      "entryType": "SPECIES",
      "supportLevel": "CATALOGADA",
      "reviewStatus": "APPROVED",
      "lifecycleStatus": "ACTIVE",
      "jurisdictions": [
        "AR"
      ],
      "sourceIds": [
        "SRC-INDEC-CNA-2018",
        "SRC-SAGYP-ESTIMACIONES"
      ],
      "aliases": [],
      "regulated": false,
      "requiresValidatedProfile": false
    },
    {
      "code": "AR-VEG-SORGO-GRANIFERO-FORRAJERO",
      "familyCode": "CEREALES-PSEUDOCEREALES",
      "canonicalName": "sorgo granífero/forrajero",
      "scientificName": null,
      "entryType": "PRODUCTION_GROUP",
      "supportLevel": "CATALOGADA",
      "reviewStatus": "APPROVED",
      "lifecycleStatus": "ACTIVE",
      "jurisdictions": [
        "AR"
      ],
      "sourceIds": [
        "SRC-INDEC-CNA-2018",
        "SRC-SAGYP-ESTIMACIONES"
      ],
      "aliases": [],
      "regulated": false,
      "requiresValidatedProfile": false
    },
    {
      "code": "AR-VEG-CENTENO",
      "familyCode": "CEREALES-PSEUDOCEREALES",
      "canonicalName": "centeno",
      "scientificName": null,
      "entryType": "SPECIES",
      "supportLevel": "CATALOGADA",
      "reviewStatus": "APPROVED",
      "lifecycleStatus": "ACTIVE",
      "jurisdictions": [
        "AR"
      ],
      "sourceIds": [
        "SRC-INDEC-CNA-2018",
        "SRC-SAGYP-ESTIMACIONES"
      ],
      "aliases": [],
      "regulated": false,
      "requiresValidatedProfile": false
    },
    {
      "code": "AR-VEG-MIJO",
      "familyCode": "CEREALES-PSEUDOCEREALES",
      "canonicalName": "mijo",
      "scientificName": null,
      "entryType": "SPECIES",
      "supportLevel": "CATALOGADA",
      "reviewStatus": "APPROVED",
      "lifecycleStatus": "ACTIVE",
      "jurisdictions": [
        "AR"
      ],
      "sourceIds": [
        "SRC-INDEC-CNA-2018",
        "SRC-SAGYP-ESTIMACIONES"
      ],
      "aliases": [],
      "regulated": false,
      "requiresValidatedProfile": false
    },
    {
      "code": "AR-VEG-ALPISTE",
      "familyCode": "CEREALES-PSEUDOCEREALES",
      "canonicalName": "alpiste",
      "scientificName": null,
      "entryType": "SPECIES",
      "supportLevel": "CATALOGADA",
      "reviewStatus": "APPROVED",
      "lifecycleStatus": "ACTIVE",
      "jurisdictions": [
        "AR"
      ],
      "sourceIds": [
        "SRC-INDEC-CNA-2018",
        "SRC-SAGYP-ESTIMACIONES"
      ],
      "aliases": [],
      "regulated": false,
      "requiresValidatedProfile": false
    },
    {
      "code": "AR-VEG-TRITICALE",
      "familyCode": "CEREALES-PSEUDOCEREALES",
      "canonicalName": "triticale",
      "scientificName": null,
      "entryType": "SPECIES",
      "supportLevel": "CATALOGADA",
      "reviewStatus": "APPROVED",
      "lifecycleStatus": "ACTIVE",
      "jurisdictions": [
        "AR"
      ],
      "sourceIds": [
        "SRC-INDEC-CNA-2018",
        "SRC-SAGYP-ESTIMACIONES"
      ],
      "aliases": [],
      "regulated": false,
      "requiresValidatedProfile": false
    },
    {
      "code": "AR-VEG-QUINOA",
      "familyCode": "CEREALES-PSEUDOCEREALES",
      "canonicalName": "quinoa",
      "scientificName": null,
      "entryType": "SPECIES",
      "supportLevel": "CATALOGADA",
      "reviewStatus": "APPROVED",
      "lifecycleStatus": "ACTIVE",
      "jurisdictions": [
        "AR"
      ],
      "sourceIds": [
        "SRC-INDEC-CNA-2018",
        "SRC-SAGYP-ESTIMACIONES"
      ],
      "aliases": [],
      "regulated": false,
      "requiresValidatedProfile": false
    },
    {
      "code": "AR-VEG-AMARANTO",
      "familyCode": "CEREALES-PSEUDOCEREALES",
      "canonicalName": "amaranto",
      "scientificName": null,
      "entryType": "SPECIES",
      "supportLevel": "CATALOGADA",
      "reviewStatus": "APPROVED",
      "lifecycleStatus": "ACTIVE",
      "jurisdictions": [
        "AR"
      ],
      "sourceIds": [
        "SRC-INDEC-CNA-2018",
        "SRC-SAGYP-ESTIMACIONES"
      ],
      "aliases": [],
      "regulated": false,
      "requiresValidatedProfile": false
    },
    {
      "code": "AR-VEG-SOJA",
      "familyCode": "OLEAGINOSAS",
      "canonicalName": "soja",
      "scientificName": null,
      "entryType": "SPECIES",
      "supportLevel": "CATALOGADA",
      "reviewStatus": "APPROVED",
      "lifecycleStatus": "ACTIVE",
      "jurisdictions": [
        "AR"
      ],
      "sourceIds": [
        "SRC-INDEC-CNA-2018",
        "SRC-SAGYP-ESTIMACIONES"
      ],
      "aliases": [],
      "regulated": false,
      "requiresValidatedProfile": false
    },
    {
      "code": "AR-VEG-GIRASOL",
      "familyCode": "OLEAGINOSAS",
      "canonicalName": "girasol",
      "scientificName": null,
      "entryType": "SPECIES",
      "supportLevel": "CATALOGADA",
      "reviewStatus": "APPROVED",
      "lifecycleStatus": "ACTIVE",
      "jurisdictions": [
        "AR"
      ],
      "sourceIds": [
        "SRC-INDEC-CNA-2018",
        "SRC-SAGYP-ESTIMACIONES"
      ],
      "aliases": [],
      "regulated": false,
      "requiresValidatedProfile": false
    },
    {
      "code": "AR-VEG-MANI",
      "familyCode": "OLEAGINOSAS",
      "canonicalName": "maní",
      "scientificName": null,
      "entryType": "SPECIES",
      "supportLevel": "CATALOGADA",
      "reviewStatus": "APPROVED",
      "lifecycleStatus": "ACTIVE",
      "jurisdictions": [
        "AR"
      ],
      "sourceIds": [
        "SRC-INDEC-CNA-2018",
        "SRC-SAGYP-ESTIMACIONES"
      ],
      "aliases": [],
      "regulated": false,
      "requiresValidatedProfile": false
    },
    {
      "code": "AR-VEG-COLZA-CANOLA",
      "familyCode": "OLEAGINOSAS",
      "canonicalName": "colza",
      "scientificName": null,
      "entryType": "PRODUCTION_GROUP",
      "supportLevel": "CATALOGADA",
      "reviewStatus": "APPROVED",
      "lifecycleStatus": "ACTIVE",
      "jurisdictions": [
        "AR"
      ],
      "sourceIds": [
        "SRC-INDEC-CNA-2018",
        "SRC-SAGYP-ESTIMACIONES"
      ],
      "aliases": [
        "canola"
      ],
      "regulated": false,
      "requiresValidatedProfile": false
    },
    {
      "code": "AR-VEG-LINO",
      "familyCode": "OLEAGINOSAS",
      "canonicalName": "lino",
      "scientificName": null,
      "entryType": "SPECIES",
      "supportLevel": "CATALOGADA",
      "reviewStatus": "APPROVED",
      "lifecycleStatus": "ACTIVE",
      "jurisdictions": [
        "AR"
      ],
      "sourceIds": [
        "SRC-INDEC-CNA-2018",
        "SRC-SAGYP-ESTIMACIONES"
      ],
      "aliases": [],
      "regulated": false,
      "requiresValidatedProfile": false
    },
    {
      "code": "AR-VEG-CARTAMO",
      "familyCode": "OLEAGINOSAS",
      "canonicalName": "cártamo",
      "scientificName": null,
      "entryType": "SPECIES",
      "supportLevel": "CATALOGADA",
      "reviewStatus": "APPROVED",
      "lifecycleStatus": "ACTIVE",
      "jurisdictions": [
        "AR"